<?xml version="1.0" encoding="UTF-8"?>
<!DOCTYPE zoologico SYSTEM "animales.dtd">
<zoologico nombre="Bioparc" ciudad="Fuengirola" webVentaEntradas="www.entradas.com"
empresaTransporte="Autocares Pérez">
	<zona nombre="desierto">Me encanta porque está nueva, amplía y muy bien cuidada
		<numeroRecintos>10</numeroRecintos>
	</zona>
	<zona nombre="ártico">Corresponde a &bioparc;</zona>
	<animal zona="desierto">
		<nombre>Piquipiqui</nombre>
		<especie>Reina Cobra</especie>
		<terrestre/>
	</animal>
	<espectaculo nombre="aves" zonas="desierto ártico"/>
</zoologico>